{
  "schemaVersion": "1.0.0",
  "projectId": "11111111-1111-4111-8111-111111111111",
  "slug": "contract-fixture",
  "version": "0.1.0",
  "name": "CONTRACT FIXTURE — not a real project",
  "category": "software",
  "visibility": "PRIVATE",
  "integration": {
    "mode": "REMOTE_API",
    "openapi": "./openapi.yaml",
    "endpointRef": "registered-fixture-v1",
    "operations": [
      {
        "capability": "algorithm.compute",
        "operationId": "compute",
        "inputSchema": "./input.schema.json",
        "outputSchema": "./output.schema.json"
      }
    ]
  },
  "capabilities": [
    "algorithm.compute"
  ],
  "dataPolicy": {
    "publicDemoData": "none",
    "requiresExplicitConsentForRemoteProcessing": true,
    "dataClasses": [
      "SYNTHETIC"
    ],
    "retentionSeconds": 0,
    "processorRef": "fixture-processor"
  }
}
