{
  "schemaVersion": "1.0.0",
  "projectId": "11111111-1111-4111-8111-111111111111",
  "slug": "contract-fixture",
  "version": "0.1.0",
  "name": "CONTRACT FIXTURE — not a real project",
  "category": "software",
  "visibility": "PRIVATE",
  "integration": {
    "mode": "SHOWCASE"
  },
  "capabilities": [
    "documentation.read"
  ],
  "dataPolicy": {
    "publicDemoData": "none",
    "requiresExplicitConsentForRemoteProcessing": false,
    "dataClasses": [
      "SYNTHETIC"
    ],
    "retentionSeconds": 0
  }
}
